{
  "asset_class": "options_cn",
  "source": "akshare",
  "endpoint_name": "option_margin",
  "title": "option_margin",
  "category": [],
  "doc_url": "https://akshare.akfamily.xyz/_sources/data/option/option.md.txt",
  "description": "",
  "parameters": [],
  "return_schema": {},
  "examples": [],
  "tags": [],
  "last_crawled": "2025-11-14T04:58:58Z",
  "version_hint": null,
  "notes": null,
  "raw_html_file": "raw_html\\_sources_data_option_option.md.txt.html"
}