{
  "asset_class": "others",
  "source": "akshare",
  "endpoint_name": "tool_trade_date_hist_sina",
  "title": "tool_trade_date_hist_sina",
  "category": [],
  "doc_url": "https://akshare.akfamily.xyz/_sources/data/tool/tool.md.txt",
  "description": "",
  "parameters": [],
  "return_schema": {},
  "examples": [],
  "tags": [],
  "last_crawled": "2025-11-14T04:58:59Z",
  "version_hint": null,
  "notes": null,
  "raw_html_file": "raw_html\\_sources_data_tool_tool.md.txt.html"
}