{
  "asset_class": "fund_cn",
  "source": "akshare",
  "endpoint_name": "fund_etf_category_sina",
  "title": "fund_etf_category_sina",
  "category": [],
  "doc_url": "https://akshare.akfamily.xyz/_sources/data/fund/fund_public.md.txt",
  "description": "",
  "parameters": [],
  "return_schema": {},
  "examples": [],
  "tags": [],
  "last_crawled": "2025-11-14T04:58:58Z",
  "version_hint": null,
  "notes": null,
  "raw_html_file": "raw_html\\_sources_data_fund_fund_public.md.txt.html"
}