{
  "asset_class": "index_cn",
  "source": "akshare",
  "endpoint_name": "index_zh_a_hist",
  "title": "index_zh_a_hist",
  "category": [],
  "doc_url": "https://akshare.akfamily.xyz/_sources/data/index/index.md.txt",
  "description": "",
  "parameters": [],
  "return_schema": {},
  "examples": [],
  "tags": [],
  "last_crawled": "2025-11-14T04:58:58Z",
  "version_hint": null,
  "notes": null,
  "raw_html_file": "raw_html\\_sources_data_index_index.md.txt.html"
}