{
  "asset_class": "others",
  "source": "akshare",
  "endpoint_name": "bank_fjcf_table_detail",
  "title": "bank_fjcf_table_detail",
  "category": [],
  "doc_url": "https://akshare.akfamily.xyz/_sources/data/bank/bank.md.txt",
  "description": "",
  "parameters": [],
  "return_schema": {},
  "examples": [],
  "tags": [],
  "last_crawled": "2025-11-14T04:58:59Z",
  "version_hint": null,
  "notes": null,
  "raw_html_file": "raw_html\\_sources_data_bank_bank.md.txt.html"
}