{
  "asset_class": "futures_cn",
  "source": "akshare",
  "endpoint_name": "futures_shfe_warehouse_receipt",
  "title": "futures_shfe_warehouse_receipt",
  "category": [],
  "doc_url": "https://akshare.akfamily.xyz/_sources/data/futures/futures.md.txt",
  "description": "",
  "parameters": [],
  "return_schema": {},
  "examples": [],
  "tags": [],
  "last_crawled": "2025-11-14T04:58:58Z",
  "version_hint": null,
  "notes": null,
  "raw_html_file": "raw_html\\_sources_data_futures_futures.md.txt.html"
}