{
  "asset_class": "crypto",
  "source": "akshare",
  "endpoint_name": "crypto_js_spot",
  "title": "crypto_js_spot",
  "category": [],
  "doc_url": "https://akshare.akfamily.xyz/_sources/data/dc/dc.md.txt",
  "description": "",
  "parameters": [],
  "return_schema": {},
  "examples": [],
  "tags": [],
  "last_crawled": "2025-11-14T04:58:58Z",
  "version_hint": null,
  "notes": null,
  "raw_html_file": "raw_html\\_sources_data_dc_dc.md.txt.html"
}