{
  "asset_class": "macro",
  "source": "akshare",
  "endpoint_name": "macro_china_shrzgm",
  "title": "macro_china_shrzgm",
  "category": [],
  "doc_url": "https://akshare.akfamily.xyz/_sources/data/macro/macro.md.txt",
  "description": "",
  "parameters": [],
  "return_schema": {},
  "examples": [],
  "tags": [],
  "last_crawled": "2025-11-14T04:58:58Z",
  "version_hint": null,
  "notes": null,
  "raw_html_file": "raw_html\\_sources_data_macro_macro.md.txt.html"
}