{
  "asset_class": "bond_cn",
  "source": "akshare",
  "endpoint_name": "bond_cov_stock_issue_cninfo",
  "title": "bond_cov_stock_issue_cninfo",
  "category": [],
  "doc_url": "https://akshare.akfamily.xyz/_sources/data/bond/bond.md.txt",
  "description": "",
  "parameters": [],
  "return_schema": {},
  "examples": [],
  "tags": [],
  "last_crawled": "2025-11-14T04:58:58Z",
  "version_hint": null,
  "notes": null,
  "raw_html_file": "raw_html\\_sources_data_bond_bond.md.txt.html"
}